push_id,type,reward,expiration,msg_kr,msg_en,msg_jp,msg_zh,msg_zh-TW,msg_th,msg_es,msg_fa,msg_af,msg_ak,msg_am,msg_ar,msg_as,msg_ay,msg_az,msg_be,msg_bg,msg_bho,msg_bm,msg_bn,msg_bs,msg_ca,msg_ceb,msg_ckb,msg_co,msg_cs,msg_cy,msg_da,msg_de,msg_doi,msg_dv,msg_ee,msg_el,msg_eo,msg_et,msg_eu,msg_fi,msg_fr,msg_fy,msg_ga,msg_gd,msg_gl,msg_gn,msg_gom,msg_gu,msg_ha,msg_haw,msg_he,msg_hi,msg_hmn,msg_hr,msg_ht,msg_hu,msg_hy,msg_id,msg_ig,msg_ilo,msg_is,msg_it,msg_jv,msg_ka,msg_kk,msg_km,msg_kn,msg_kri,msg_ku,msg_ky,msg_la,msg_lb,msg_lg,msg_ln,msg_lo,msg_lt,msg_lus,msg_lv,msg_mai,msg_mg,msg_mi,msg_mk,msg_ml,msg_mn,msg_mni-Mtei,msg_mr,msg_ms,msg_mt,msg_my,msg_ne,msg_nl,msg_no,msg_nso,msg_ny,msg_om,msg_or,msg_pa,msg_pl,msg_ps,msg_pt,msg_qu,msg_ro,msg_ru,msg_rw,msg_sa,msg_sd,msg_si,msg_sk,msg_sl,msg_sm,msg_sn,msg_so,msg_sq,msg_sr,msg_st,msg_su,msg_sv,msg_sw,msg_ta,msg_te,msg_tg,msg_ti,msg_tk,msg_tl,msg_tr,msg_ts,msg_tt,msg_ug,msg_uk,msg_ur,msg_uz,msg_vi,msg_xh,msg_yi,msg_yo,msg_zh-CN,msg_zu
100101,newbie,700001;10000,7,▶다이아10000◀테이머님! 지금 접속해 지원품을 수령하세요.,▶10000 Diamonds!◀ Collect your supplies now!,▶ダイヤ10000◀テイマー！今すぐログインして支援品を受け取ってください。,▶鑽石10000◀馴龍師！請即刻連線，領取支援品。,▶鑽石10000◀馴龍師！請即刻連線，領取支援品。,▶10000 เพชร◀เทมเมอร์! เข้าเกมตอนนี้เพื่อรับของสนับสนุน,▶Diamante 10000◀¡Domador! Conéctate ahora para recibir un regalo.,▶10000 الماس!◀ هم اکنون لوازم خود را جمع آوری کنید!,▶10 000 Diamante!◀ Versamel jou voorrade nou!,▶10000 Diamond ahorow a wɔde yɛ nneɛma!◀ Boaboa wo nneɛma ano mprempren!,▶10000 አልማዞች!◀ አቅርቦቶችዎን አሁን ይሰብስቡ!,◀ 10000 الماس! ◀ اجمع مستلزماتك الآن!,▶10000 হীৰা!◀ এতিয়াই আপোনাৰ যোগান সংগ্ৰহ কৰক!,▶10000 Diamantenaka!◀ ¡Jichhax yänak apthapipxam!,▶10000 Brilyantlar!◀ Təchizatlarınızı indi toplayın!,▶10000 Алмазы!◀ Збірайце свае запасы зараз!,▶10 000 Диаманти!◀ Съберете запасите си сега!,▶10000 हीरा के बा!◀ अब आपन आपूर्ति इकट्ठा करीं!,▶10000 Diamant (Diamant) minnu bɛ yen!◀ Aw ye aw ka fɛnw lajɛ sisan!,▶10000 হীরা! ◀ এখন আপনার সরবরাহ সংগ্রহ করুন!,▶10000 Dijamanti!◀ Pokupite svoje zalihe sada!,▶10.000 Diamants!◀ Recolliu els vostres subministraments ara!,▶10000 Mga diamante!◀ Kolektaha ang imong mga suplay karon!,▶10000 ئەڵماس!◀ ئێستا پێداویستیەکانت کۆبکەرەوە!,▶ 10000 Diamanti! ◀ Cullate i vostri pruvisti avà!,▶10 000 Diamanty!◀ Sbírejte své zásoby nyní!,▶10000 Diemwntau!◀ Casglwch eich cyflenwadau nawr!,▶10000 Diamanter!◀ Saml dine forsyninger nu!,▶10000 Diamanten!◀ Sammle jetzt deine Vorräte!,▶10000 हीरे!◀ अज्जै थमां गै अपनी आपूर्ति इकट्ठा करो!,▶10000 ޑައިމަންޑްސް އެވެ!◀ މިހާރު ތިޔަބޭފުޅުންގެ ސާމާނު އެއްކުރައްވާ!,▶10000 Diamond-wo!◀ Ƒo wò nuzazãwo nu ƒu fifia!,▶10000 Διαμάντια!◀ Συλλέξτε τις προμήθειες σας τώρα!,▶10000 Diamantoj!◀ Kolektu viajn provizojn nun!,▶10000 Teemandid!◀ Koguge oma tarvikud kohe kokku!,▶10000 Diamanteak!◀ Bildu zure hornigaiak orain!,▶10000 Timantit!◀ Kerää tarvikkeet nyt!,▶10 000 Diamant!◀ Récupérez vos fournitures maintenant !,▶10000 Diamanten!◀ Sammelje jo foarrieden no!,▶10000 Diamaint!◀ Bailigh do sholáthairtí anois!,▶ 10000 Daoimeanan! ◀ Cruinnich na stuthan agad a-nis!,▶10.000 Diamantes!◀ Recolle os teus materiais agora!,▶10000 Diamante-kuéra rehegua!◀ ¡Embyaty ko'ágã umi mba'e reguerekóva!,▶10000 हिरे हांचो आस्पाव जाता!◀ आतां तुमची पुरवण एकठांय करात!,▶10000 હીરા!◀ હવે તમારો પુરવઠો એકત્રિત કરો!,▶10000 Diamonds!◀ Tattara kayan ku yanzu!,▶10000 Daimana!◀ E hōʻiliʻili i kāu lako i kēia manawa!,▶10000 יהלומים!◀ אסוף את המצרכים שלך עכשיו!,▶10000 हीरे!◀ अभी अपनी आपूर्ति एकत्र करें!,▶ 10000 Pob zeb diamond!◀ Sau koj cov khoom siv tam sim no!,▶10 000 Dijamant!◀ Prikupite svoje zalihe sada!,▶10000 Diamonds!◀ Kolekte founiti ou yo kounye a!,▶10000 Gyémántok!◀ Gyűjtse össze kellékeit most!,▶10000 Ադամանդներ!◀ Հավաքեք ձեր պաշարները հիմա:,▶10.000 Diamond!◀ Kumpulkan persediaan Anda sekarang!,▶10000 Ola diamond!◀ Chịkọta akụrụngwa gị ugbu a!,▶10000 Dagiti Diamante!◀ Kolektaem itan dagiti abastom!,▶10000 Demantar!◀ Safnaðu birgðum þínum núna!,▶10000 Diamanti!◀ Raccogli subito le tue scorte!,▶10000 Inten!◀ Nglumpukake persediaan saiki!,▶10000 ბრილიანტები!◀ შეაგროვეთ თქვენი მარაგი ახლავე!,▶10000 Гауһар тастар!◀ Жабдықтарыңызды қазір жинаңыз!,▶ 10000 ពេជ្រ ◀ ប្រមូលការផ្គត់ផ្គង់របស់អ្នកឥឡូវនេះ!,▶10000 ವಜ್ರಗಳು!◀ ನಿಮ್ಮ ಸರಬರಾಜುಗಳನ್ನು ಈಗಲೇ ಸಂಗ್ರಹಿಸಿ!,▶10000 Daymɔnd dɛn!◀ Kɔlekt yu sapɔt naw!,▶10000 Elmas!◀ Niha pêdiviyên xwe berhev bikin!,▶10000 Алмаз!◀ Зарылдарыңызды азыр чогултуңуз!,▶10000 Crystallini!◀ Collecta commeatus nunc!,▶10000 Diamanten!◀ Sammelt elo Är Ëmgeréits!,▶ Dayimanda 10000 !◀ Kuŋŋaanya ebikozesebwa byo kati!,▶10000 Ba diamants!◀ Sangisa biloko na yo sikoyo!,▶ 10000 ເພັດ!◀ ເກັບກໍາການສະຫນອງຂອງທ່ານໃນປັດຈຸບັນ!,▶10 000 Deimantai!◀ Surinkite savo reikmenis dabar!,▶10000 Diamond te pawh a awm!◀ Tunah hian i supply te chu la khawm rawh!,▶10 000 Dimanti!◀ Savāc savus krājumus tūlīt!,▶10000 हीरा!◀ अखन अपन आपूर्ति एकत्रित करू!,▶10000 diamondra!◀ Angony izao ny entanao!,▶10000 Taimana!◀ Kohikohia o taonga inaianei!,▶10000 Дијаманти!◀ Соберете ги вашите залихи сега!,▶10000 വജ്രങ്ങൾ!◀ നിങ്ങളുടെ സാധനങ്ങൾ ഇപ്പോൾ ശേഖരിക്കൂ!,▶10000 Алмаз!◀ Хэрэгсэлээ яг одоо цуглуулаарай!,▶10000 ꯗꯥꯏꯃꯟꯗꯁꯤꯡ꯫!◀ ꯍꯧꯖꯤꯛ ꯑꯗꯣꯃꯒꯤ ꯁꯞꯂꯥꯏꯁꯤꯡ ꯈꯣꯃꯖꯤꯜꯂꯨ!,▶10000 हिरे!◀ तुमचा पुरवठा आता गोळा करा!,▶10000 berlian!◀ Kumpul bekalan anda sekarang!,▶10000 Djamanti!◀ Iġbor il-provvisti tiegħek issa!,▶10000 စိန်များ!◀ မင်းရဲ့ပစ္စည်းတွေကို အခုပဲစုဆောင်းလိုက်ပါ။,▶10000 हीरा! ◀ आफ्नो आपूर्तिहरू अहिले सङ्कलन गर्नुहोस्!,▶10.000 diamanten!◀ Verzamel nu je benodigdheden!,▶10000 Diamanter!◀ Samle forsyningene dine nå!,▶10000 Ditaamane!◀ Kgoboketša ditlabakelo tša gago gona bjale!,▶10000 Ma diamondi!◀ Sungani zinthu zanu tsopano!,▶ Daayimandii 10000 !◀ Dhiyeessii keessan amma walitti qabaa!,00 10000 ହୀରା |! Your ବର୍ତ୍ତମାନ ଆପଣଙ୍କର ସାମଗ୍ରୀ ସଂଗ୍ରହ କରନ୍ତୁ!,▶10000 ਹੀਰੇ!◀ ਹੁਣੇ ਆਪਣੀ ਸਪਲਾਈ ਇਕੱਠੀ ਕਰੋ!,▶10000 Diamenty!◀ Zbierz swoje zapasy już teraz!,▶10000 الماس! ◀ همدا اوس خپل توکي راټول کړئ!,▶10.000 Diamantes!◀ Recolha seus suprimentos agora!,▶10000 Diamantekuna!◀ ¡Kunanpacha suministroykikunata huñuy!,▶10000 de Diamante!◀ Adună-ți proviziile acum!,▶10 000 Алмазы!◀ Соберите свои припасы прямо сейчас!,▶ 10000 Diyama! ◀ Kusanya ibikoresho byawe nonaha!,▶10000 हीरकाः!◀ अधुना एव स्वस्य आपूर्तिं संग्रहयन्तु!,▶10000 هيرا! ◀ ھاڻي پنھنجو سامان گڏ ڪريو!,▶10000 දියමන්ති!◀ දැන් ඔබේ සැපයුම් එකතු කරන්න!,▶10 000 Diamanty!◀ Zbierajte svoje zásoby teraz!,▶10000 Diamanti!◀ Zberite svoje zaloge zdaj!,▶10000 taimane!◀ Ao mai au sapalai i le taimi nei!,▶10000 Madhaimani!◀ Unganidza zvinhu zvako izvozvi!,▶10000 Dheemman!◀ Ururi agabkaaga hadda!,▶10000 Diamante!◀ Mblidhni furnizimet tuaja tani!,▶10000 Дијаманти!◀ Прикупите своје залихе одмах!,▶10000 Litaemane!◀ Bokella thepa ea hau hona joale!,▶10000 Inten!◀ Kumpulkeun suplai anjeun ayeuna!,▶10 000 Ruter!◀ Samla dina förnödenheter nu!,▶ Almasi 10000 !◀ Kusanya vifaa vyako sasa!,▶10000 வைரங்கள்!◀ உங்கள் பொருட்களை இப்போதே சேகரிக்கவும்!,▶10000 వజ్రాలు!◀ మీ సామాగ్రిని ఇప్పుడే సేకరించండి!,▶10000 Алмос!◀ Захираҳои худро ҳозир ҷамъ кунед!,▶10000 ኣልማዝ!◀ ሕጂ ቀረብኩም ኣኪብኩም!,00 10000 Göwher! Supplies Indi üpjünçiligiňizi ýygnaň!,▶10000 Diamonds!◀ Kolektahin ang iyong mga supply ngayon!,▶10000 Elmaslar!◀ Malzemelerinizi şimdi toplayın!,▶10000 Tidayimani!◀ Hlengeleta switirhisiwa swa wena sweswi!,00 10000 Алмаз! Your Хәзер кирәк-яракларыгызны җыегыз!,00 10000 ئالماس! Supplies ھازىر تەمىناتىڭىزنى يىغىڭ!,▶10000 Діаманти!◀ Зберіть свої запаси зараз!,▶10000 ہیرے!◀ اپنا سامان ابھی جمع کریں!,▶10000 Olmoslar!◀ Zaryadlaringizni hozir yig'ing!,▶ 10000 Kim cương!◀ Hãy thu thập nguồn cung cấp của bạn ngay bây giờ!,▶10000 Iidayimani!◀ Qokelela iimpahla zakho ngoku!,▶10000 דיאַמאָנדס!◀ קלייַבן דיין סאַפּלייז איצט!,▶10000 Awọn okuta iyebiye!◀ Gba awọn ipese rẹ ni bayi!,▶10000钻石！◀ 立即收集你的补给品！,▶10000 Amadayimane!◀ Qoqa izimpahla zakho manje!
100201,arena,,,콜로세움 시즌이 종료되었습니다. 접속해 보상을 수령하세요.,Colosseum season has ended. Collect your reward now.,コロシアムシーズンが終了しました。ログインして報酬を受け取ってください。,競技場賽季已結束。請連線領取獎勵。,競技場賽季已結束。請連線領取獎勵。,ซีซันโคลอสเซียมปิดแล้ว เข้าเกมเพื่อรับรางวัล,La temporada del Coliseo ha finalizado. Conéctate para recibir recompensas.,,,,,,,,,,,,,,,,,,,,,,,,,,,,,,,,,,,,,,,,,,,,,,,,,,,,,,,,,,,,,,,,,,,,,,,,,,,,,,,,,,,,,,,,,,,,,,,,,,,,,,,,,,,,,,,,,,,,,,,,,,,,,,,
100301,cldg,,,클랜던전 시즌이 종료되었습니다. 접속해 보상을 수령하세요.,Clan Dungeon season has ended. Collect your reward now.,クランダンジョンシーズンが終了しました。ログインして報酬を受け取ってください。,戰隊副本賽季已結束。請連線領取獎勵。,戰隊副本賽季已結束。請連線領取獎勵。,ซีซันดันเจี้ยนแคลนปิดแล้ว เข้าเกมเพื่อรับรางวัล,La temporada de la Mazmorra del Clan han finalizado. Conéctate para recibir recompensas.,,,,,,,,,,,,,,,,,,,,,,,,,,,,,,,,,,,,,,,,,,,,,,,,,,,,,,,,,,,,,,,,,,,,,,,,,,,,,,,,,,,,,,,,,,,,,,,,,,,,,,,,,,,,,,,,,,,,,,,,,,,,,,,
100401,arena_cldg,,,"콜로세움, 클랜던전 시즌이 종료되었습니다. 접속해 보상을 수령하세요.",Colosseum and Clan Dungeon seasons have ended. Collect your reward now.,コロシアム、クランダンジョンシーズンが終了しました。ログインして報酬を受け取ってください。,競技場、戰隊副本賽季已結束。請連線領取獎勵。,競技場、戰隊副本賽季已結束。請連線領取獎勵。,"ซีซันโคลอสเซียม, ดันเจี้ยนแคลนปิดแล้ว เข้าเกมเพื่อรับรางวัล",La temporada del Coliseo y de la Mazmorra del Clan han finalizado. Conéctate para recibir recompensas.,,,,,,,,,,,,,,,,,,,,,,,,,,,,,,,,,,,,,,,,,,,,,,,,,,,,,,,,,,,,,,,,,,,,,,,,,,,,,,,,,,,,,,,,,,,,,,,,,,,,,,,,,,,,,,,,,,,,,,,,,,,,,,,
100501,clanwar,,,클랜전 시즌이 종료되었습니다. 접속해 보상을 수령하세요.,Clan War season has ended. Collect your reward now.,クラン戦シーズンが終了しました。ログインして報酬を受け取ってください。,戰隊戰賽季已結束。請連線領取獎勵。,戰隊戰賽季已結束。請連線領取獎勵。,ซีซันสงครามแคลนปิดแล้ว เข้าเกมเพื่อรับรางวัล,La temporada de Guerra de Clanes ha finalizado. Conéctate para recibir recompensas.,,,,,,,,,,,,,,,,,,,,,,,,,,,,,,,,,,,,,,,,,,,,,,,,,,,,,,,,,,,,,,,,,,,,,,,,,,,,,,,,,,,,,,,,,,,,,,,,,,,,,,,,,,,,,,,,,,,,,,,,,,,,,,,
100601,ancient,,,고대의 탑 시즌이 종료되었습니다. 접속해 보상을 수령하세요.,Ancient Tower season has ended. Collect your reward now.,古代の塔シーズンが終了しました。ログインして報酬を受け取ってください。,古代之塔賽季已結束。請連線領取獎勵。,古代之塔賽季已結束。請連線領取獎勵。,ซีซันหอคอยโบราณปิดแล้ว เข้าเกมเพื่อรับรางวัล,La temporada de la Torre Antigua ha finalizado. Conéctate para recibir recompensas.,,,,,,,,,,,,,,,,,,,,,,,,,,,,,,,,,,,,,,,,,,,,,,,,,,,,,,,,,,,,,,,,,,,,,,,,,,,,,,,,,,,,,,,,,,,,,,,,,,,,,,,,,,,,,,,,,,,,,,,,,,,,,,,
100701,challenge,,,그림자의 신전 시즌이 종료되었습니다. 접속해 보상을 수령하세요.,Temple of Shadows season has ended. Collect your reward now.,影の神殿シーズンが終了しました。ログインして報酬を受け取ってください。,影子神殿賽季已結束。請連線領取獎勵。,影子神殿賽季已結束。請連線領取獎勵。,ซีซันศาลแห่งเงาปิดแล้ว เข้าเกมเพื่อรับรางวัล,La temporada del Templo de las Sombras ha finalizado. Conéctate para recibir recompensas.,,,,,,,,,,,,,,,,,,,,,,,,,,,,,,,,,,,,,,,,,,,,,,,,,,,,,,,,,,,,,,,,,,,,,,,,,,,,,,,,,,,,,,,,,,,,,,,,,,,,,,,,,,,,,,,,,,,,,,,,,,,,,,,
100801,fevertime,,,▶종료 임박◀지금 접속해 일일 핫타임을 사용하세요.,▶ Ending Soon ◀ Log in now and use your Daily Hot Time!,▶終了間近◀今すぐログインしてデイリーホットタイムを使おう,▶即將結束◀請立刻連線使用每日Hot Time。,▶即將結束◀請立刻連線使用每日Hot Time。,▶ใกล้สิ้นสุด◀ รีบเข้าเกมตอนนี้แล้วใช้ฮอตไทม์ประจำวันเลยสิ,▶Finalización Próxima◀ Conéctate ahora para ingresar a Tiempo Cálido diariamente.,,,,,,,,,,,,,,,,,,,,,,,,,,,,,,,,,,,,,,,,,,,,,,,,,,,,,,,,,,,,,,,,,,,,,,,,,,,,,,,,,,,,,,,,,,,,,,,,,,,,,,,,,,,,,,,,,,,,,,,,,,,,,,,
100901,svip,700318;1,14,(광고) SVIP 테이머님을 위해 신화 드래곤 선택권을 선물로 준비했어요! (수신거부: 설정에서 변경),We prepared a Mythic Dragon Selection Ticket as a gift for SVIP!,SVIPのプレゼントとして、エピックドラゴン選択券を用意しました!,爲了SVIP準備了神話神龍選擇券,爲了SVIP準備了神話神龍選擇券,เราเตรียมตั๋วเลือกดราก้อนเทวตำนานไว้สำหรับ SVIP,¡Preparamos un billete de Ticket de selección de dragón mítico como regalo para el SVIP!,,,,,,,,,,,,,,,,,,,,,,,,,,,,,,,,,,,,,,,,,,,,,,,,,,,,,,,,,,,,,,,,,,,,,,,,,,,,,,,,,,,,,,,,,,,,,,,,,,,,,,,,,,,,,,,,,,,,,,,,,,,,,,,